ScenicSpotID,ScenicSpotName,DescriptionDetail,Description,Phone,Address,ZipCode,TravelInfo,OpenTime,Picture,Position,ParkingPosition,TicketInfo,Remarks,City,SrcUpdateTime,UpdateTime
C1_376540000A_000325,都蘭遺址,都蘭，源自當地阿美語A&rsquo;tolan(音譯：阿都蘭)，意指石頭很多以及地震頻繁的地方。臺東縣東河鄉都蘭村是一個典型的阿美族部落，這裡背倚都蘭山，面俯廣闊無際的太平洋，景色宜人。由於臺東海岸山脈歷經長年板塊運動的擠壓，呈現綿延百餘公里的山巒，壯觀的海階地形綿延長達4公里，這裡的地形和長濱鄉的海階緩坡非常類似，或許因著古老地形的恩賜，千年的地質變動造就了一處珍貴的考古文化──都蘭遺址。都蘭遺址是東海岸巨石文化的代表性遺址，距今約3000年，遺址分成「石壁區」與「石棺區」，除了這兩處已劃定為三級古蹟之外，另有三處文化遺留地點：土地銀行辦公室後面的臺地、都蘭林場的土銀建物右下方以及退輔院都蘭農莊的後院，這個地點因為沒有列入遺址範圍，因此無法進行任何考古遺跡的保存與維護。目前石壁區僅殘留三塊豎立原地的石壁，其中一塊上面有一對半球的突起，下方則呈現突出樣貌，因此人們替它取了一個有趣的名字：「孕婦石」。史前文化留給人們對過去時空無盡的想像，走出都蘭遺址旁的林蔭小徑之後，記得你曾經在這塊安靜又古老的土地，行經千年前人類的居住之地。,都蘭遺址位於東河鄉都蘭村西北方約1公里的平緩海階地，是東海岸巨石文化的代表性遺址，距今約3000年前，根據考古學家的推測，都蘭遺址屬於麒麟文化，目前僅殘留由三塊豎立在地面上的石壁組成的石列與岩棺，民國77年己被臺東縣政府指定為三級古蹟。,886-8-9841520,臺東縣959東河鄉都蘭山下土地銀行農場山麓,959,搭乘公車：搭乘鼎東客運海線8101、8102、8103、8109、8119、8120、8122次公車於都蘭A站下車，轉入站牌旁圓山產業道路後距離都蘭遺址石棺區還有約1.7公里，距離石壁區還有約2.4公里。若體力無法負荷，建議租賃交通工具前往。,全天候開放,{},"{'PositionLon': 121.21952819824219, 'PositionLat': 22.884870529174805, 'GeoHash': 'wsn4nqj65'}",{},免費參觀,遺址為文化遺產，請保持公德心，維護環境整潔，切勿破壞。,臺東縣,2023-07-13T01:40:49+08:00,2023-07-13T02:10:57+08:00
C1_376540000A_000326,登仙橋遊憩區,登仙橋遊憩區位於台23線(東富公路)入口，周邊景點有泰源幽谷及東河橋遊憩區等，橫跨馬武窟溪切穿海岸山脈形成的峽谷，日治時期此峽谷名為「昇仙峽」，可想見其壯闊風采。而登仙橋舊橋為吊橋形式，舊名亦為「昇仙橋」。  在登仙橋除了可以欣賞馬武窟溪切割都蘭山集塊岩而成的壯觀峽谷地形之外，晨昏覓食時間這裡也有成群結隊不怕人的獼猴出沒，偶爾還可看見猴王出現在橋上，十分有趣。  為免發生意外，獼猴接近討食時請勿餵食，野生獼猴攻擊性強，拍照時請特別注意。,登仙橋遊憩區與東河橋、泰源幽谷連成一氣，這裡是臺灣獼猴的樂園，一點都不怕生的牠們，在橋上各個角落出沒，或蹲或爬，淘氣可愛的模樣讓遊客手中的相機一刻也無法休息，拼命按下快門。馬武窟溪自登仙橋底下靜靜流過，碧綠溪水與陡峭峽谷景觀相互襯托，景色秀麗，走在這裡，讓人神清氣爽。,886-8-9841520,臺東縣959東河鄉東富公路北行泰源村的入口,959,搭乘公車：搭乘鼎東客運海線8107、8109、8110次公車(往泰源、北源國小或東河農場方向)，於泰源站下車後，一路往南步行(沿東23道路接至台23線(東富公路))，步行約1.5公里即可抵達。,全天候開放,{},"{'PositionLon': 121.2951889038086, 'PositionLat': 22.989049911499023, 'GeoHash': 'wsn6b1h2y'}",自然風景類,遊憩類,{},1.為了避免獼猴攻擊遊客的事件，請儘量不要接近牠們。2.請勿餵食食物。3.請注意落石。,臺東縣,2023-07-13T01:40:49+08:00,2023-07-13T02:10:57+08:00
C1_376540000A_000327,都蘭山登山步道,自台11線公路前往臺東都蘭，行經水往上流、新蘭、北郡界，在郡界與北郡界之間，轉入原野產業道路，大約4.3公里處可以銜接都蘭山步道。都蘭山被當地阿美族與卑南族人視為聖山，是一神聖的象徵與祭拜場所，都蘭山雖然海拔僅1190公尺，但山形聳立，外觀挺拔峻峭，加上受到東側太平洋海水濕氣的影響，造就都蘭山終年雲霧繚繞的神秘氣氛，好似一位美人被簇擁保護著，因此又有「美人山」之稱。都蘭山登山口有都蘭林場，登上山頂，泰源盆地、池上以南臺東縱谷、臺東平原盡收眼底；東面遠眺太平洋，綠島、蘭嶼清晰可見，為登山望遠的好場所。都蘭山林相豐富，登山時可以看見許多高大筆直的筆筒樹，樹皮光滑的九穹，蛇木、金禪蘭、竹柏蘭等等，也可見許多當地原住民常用的植物，例如阿美族人平時用來包糯飯的假酸漿。隨著步道繼續向上爬升，高度的不同，都蘭山的林相也有所變化。因為環境潮濕，都蘭山的樹林裡有許多蔓藤纏繞，彷彿電影「泰山」的場景。　　登頂之前，會行經一處「普悠瑪」祭臺，這塊祭臺劃分了阿美族與卑南族的領域界線，阿美族人靠海岸這邊，卑南族人則是靠山那邊，彼此互不侵犯。族人們至今會到這塊石碑進行祭拜，向祖靈祈求或表達感謝之意。受到盛行雲霧帶的影響，都蘭山下午容易下雨，天雨路滑，前來登山的遊客，記得準備雨具與手杖。,"都蘭山最高山峰標高海拔1,190公尺，是東河鄉東河農場以南最高峰，也是登山健身的好去處，也是各登山社團時常辦理登山活動的地區之一。",886-8-9841520,臺東縣959東河鄉台11省道151.5公里轉西邊,959,搭乘公車：搭乘鼎東客運海線8101、8102、8103、8109、8119、8120、8122次公車，於南郡界下車後即可看到都蘭山石碑，左轉上去經過石碑後遇到叉路時左轉，並沿著柏油路直行約2.5公里(步行約46分鐘)後，道路會變成水泥路，再續行1.5公里(步行約28分鐘，直行前進、不要走小路)後，即可抵達都蘭山涼亭與都蘭山步道入口。,全天候開放,{},"{'PositionLon': 121.17961120605469, 'PositionLat': 22.872539520263672, 'GeoHash': 'wsn4jeb61'}",遊憩類,都蘭山步道入口旁有停車場。,{},1.山區天氣變化大，行前請注意攜帶相關應變用品。2.雖然都蘭山步道並不困難，還是請謹慎評估自身體力負荷並盡量結伴前往，以免發生意外狀況。,臺東縣,2023-07-13T01:40:49+08:00,2023-07-13T02:10:57+08:00
C1_376540000A_000329,加母子灣,加母子灣是阿美族人每年kilumaan(海祭)的場所，也是族人舉辦各項婚喪喜慶bagerlan儀式的地方，而加母子灣的阿美名kamod原義就是抓取、獲得之意，代表此地的海洋生物是最容易獲取，視為祖先留下的神聖場域。加母子灣美景天成風景如畫，遠眺臺東視野遼闊，夕陽美景令人賞心悅目，海灣北側有美麗的珊瑚礁，珊瑚覆蓋海底礁石的比率高，蘊藏豐富的魚類及海膽等，吸引許多魚類棲息其間，海底世界相當可觀，以石珊瑚居多，藻類、貝類、大型底棲無脊動物和珊瑚礁魚類的種類和數量都很豐富，且因為風浪小，又是砂質底域，加上沒有受到污染，海水乾淨清澈，可以在淺海區浮潛欣賞多采多姿的海底世界，也適合划獨木舟等海上運動。加母子灣由於地質特殊，屬於岩岸地形，幾乎都是石頭和石礫，有很多漂亮的石頭，運氣好的話，還可撿到從花東縱谷沖刷而下的菊花玉石、白玉，又融合當地阿美族的人文色彩，是花東海岸線菁華旅遊路線之一。,依偎都蘭灣北方的加母子灣，是灣裡之灣的風景遊憩區，雖然嬌小，卻多一層天然屏障，海浪更是平靜無波，是喜愛水上運動遊客的最愛，更是過往旅客，相機裡要帶走的絕世美景。,886-8-9841520,臺東縣959東河鄉東蘭村都蘭灣北段,959,搭乘公車：搭乘鼎東客運海線8101、8102、8103、8109、8120、8122次公車，於漁澳站下車，往台11線南下方向行進約550公尺，看到涼亭後沿旁邊階梯下去後即可到達。,全天候開放,{},"{'PositionLon': 121.21018981933594, 'PositionLat': 22.864160537719727, 'GeoHash': 'wsn4n4q96'}",自然風景類,遊憩類,{},臺東縣,2023-07-13T01:40:49+08:00,2023-07-13T02:10:57+08:00
C1_376540000A_000331,新東糖廠文化園區,新東糖廠建於日本殖民統治臺灣期間，第二次世界大戰末期曾經遭到盟軍砲彈轟炸，雖然已經廢棄多年，但仍保留結構完整的木造房舍、辦公室、升旗台和工廠，於民國80年結束營業生產後，在臺東縣政府輔導下積極轉型為「都蘭紅糖文化園區」，將閒置空間轉化為藝術家合力經營的藝術文化園區。 如今，舊時的辦公室已改變為具有懷舊風味的咖啡館，木造房舍已規劃成民宿以及阿美族傳統文化館。2010年2月，國家音樂廳上演了一齣名為「很久沒有敬我了你」的電影音樂劇，演出後頗受好評，劇中許多場景就是在這裡的咖啡館所拍攝。 民國101年臺東縣政府建設處施作新東糖廠廠區改善工程(太平洋海岸步道整體發展計畫)，增設綠地空間與休憩設施，並將廣場地面重新整理，成為聚落活動舉辦的主要空間。,新東糖廠曾是臺東民間經營的紅糖製造廠，於民國80年結束營業生產後，在臺東縣政府輔導下積極地轉型為「都蘭紅糖文化園區」，將閒置空間轉化為藝術家合力經營的藝術文化園區，逐漸發展成為一個充滿藝文氣息的空間，提供地方部落、文化藝術團體演出場地，這裡已成為東臺灣藝術工作者交流、展演的舞台，未來還有許多可以開發及經營的空間。,886-8-9531212,臺東縣959東河鄉都蘭村61號,959,搭乘公車：1.搭乘搭鼎東客運海線8101、8102、8103、8109、8119、8120、8122次公車(往都蘭、成功、長濱方向)，於都蘭B站下車，往台11線南下方向步行約50公車(約1分鐘)即可到達。2.搭乘台灣好行東部海岸線於都蘭糖廠站下車即可到達。,週一至周日 08:30–18:00,{},"{'PositionLon': 121.22654724121094, 'PositionLat': 22.872390747070312, 'GeoHash': 'wsn4nef3r'}",遊憩類,內有汽機車停車格,{},遇國定假日、寒暑假，機動調整開放時間。,臺東縣,2023-07-13T01:40:49+08:00,2023-07-13T02:10:57+08:00
C1_376540000A_000333,三仙台風景區,位於臺東縣成功鎮東北方的三仙台，全島面積約22公頃，最高點海拔約77公尺。地質屬於都巒山集塊岩，原是一處岬角，但因海水侵蝕，逐漸蝕斷岬角頸部，而成了離岸島，島的四周珊瑚礁環繞，海底熱帶魚群聚，適合潛水和游泳。而因其為火山噴發而出的小島，島上奇石分布，除了仙劍峽、合歡洞等與三仙台故事有關的天然奇景外，並且散布著海蝕溝、壼穴、海蝕柱、海蝕凹壁等海蝕景觀，登島遊覽頗富尋幽訪勝之趣。其中又以三座珊瑚礁岩形成的山峰最為獨特，因此民間相傳，八仙過海時，李鐵拐，何仙姑和呂洞賓曾在此休憩，烙印了仙跡，因此取名為三仙台。除了充滿故事外，生態景觀豐富的三仙台，可是海洋性鳥類的最佳棲息環境，礫岩之間有岩鷺出沒，夏天常見燕鷗，附近海域魚類豐富，是漁場亦是有名的磯釣場所。 島上處處可見林投、臺灣海棗、白水木、濱刀豆等濱海植物，是研究海岸植物生態的重要據點，並被列為自然保護區。島的南端到基翬一帶海域，有美麗的珊瑚礁和熱帶魚群，而臺灣特有種「臺灣擬絲珊瑚」也在這裡的海面下生活，三仙台可是花東海岸線海底景觀最美的地方。 三仙台八拱橋因受受地震影響橋體出現位移，封閉至2025年不能登橋上島。園區仍繼續開放，此期間前往請遵守相關告示並注意自身之安全，如有不便，敬請見諒！,清晨的八拱跨海步橋和海洋被染上金黃色的曙光，雲彩瞬間呈現多種模樣，美麗的元素相互輝映，在三仙台迎接臺灣本島第一道曙光是幸福的體驗。八拱跨海步橋銜接三仙台和本島，是東海岸極為著名的地標，遊客可輕易到島上欣賞三仙台原始的風貌，環島公路步行約需要兩小時，但親身感受地質教室、神仙傳說，絕對值得遊客繞一圈。,886-8-9854097,臺東縣961成功鎮三仙里基翬路74號,961,搭乘公車：1.搭乘鼎東客運海線8101、8102、8105、8106、8119、8181次公車於三仙台站下車。2.搭乘台灣好行東部海岸線於終點站三仙台遊憩區站下車。3.搭乘花蓮客運1127、1145次公車於三仙台站下車。,全天候開放,{},"{'PositionLon': 121.40825653076172, 'PositionLat': 23.123310089111328, 'GeoHash': 'wsn7d9qz1'}",遊憩類,三仙台遊憩區需酌收停車清潔費假日：大型車200元，小型車60元，機車20元。非假日：大型車170元，小型車50元，機車15元。,{},需酌收停車清潔費,1.三仙台燈杆地形險峻，通路狹窄，民眾如要造訪，宜選擇晴朗的好天氣，以策安全。2.三仙台島區被列為自然保護區，請愛護自然生態，不採集任何動植物，以免觸法。3.本遊憩範圍內全面禁菸，...,臺東縣,2023-07-13T01:40:49+08:00,2023-07-13T02:10:57+08:00
C1_376540000A_000335,臺東縣自然史教育館,臺東縣自然史教育館前身是民國74年成立於臺東縣成功鎮三仙國小的貝殼陳列館，民國83年省立博物館以此為基礎，設立臺東縣自然史教育館，將原本的貝殼標本做有系統的整理、展示與研究，現有館藏557種的貝殼標本，同時增設礦物展示室，蒐集世界各地的海洋珍寶及礦石，結合了自然資源和教學的功能，是了解東海岸蘊藏珍貴海洋及山脈資源最好的教室。臺東縣自然史教育館的設立，證明美麗的東海岸擁有的不只是海天山色，來自海洋深處的生物演化證物更是大自然所賜予最神奇的禮物。臺東縣自然史教育館的館藏貝殼標本，以都被視為活化石的阿當嵩翁戎螺和龍宮翁戎螺最受注目。阿當嵩翁戎螺是在距今5億7千萬年前即出現的翁戎螺科，在19世紀末又發現現生種，因此被視為活化石。阿當嵩翁戎螺喜歡吃海綿，不僅擁有大型而美麗的外殼，並具有極高的學術價值，是貝類研究者或集貝者不能錯過的珍貴標本。臺東縣自然史教育館的館藏阿當嵩翁戎螺，是民國86年購置，直徑10公分，產地在巴哈馬深海。龍宮翁戎螺也被視為活化石，民國58~59年在釣魚台列島海域發現大量龍宮翁戎螺，造成「龍宮貝震撼」，進而促使中華民國貝類學會的誕生。臺東縣自然史教育館的館藏龍宮翁戎螺，直徑8.5公分，屬小型龍宮翁戎螺，產地在臺灣東北海域深海。臺東縣自然史教育館三樓礦物展示室，陳列花蓮和臺東地區礦石岩石200多件，包括產自海岸山脈的軟玉、臺灣藍寶石和總總石等寶石，以原石和雕琢品對照方式，提供遊客認識和了解這些美石在工藝上的應用和價值。臺灣藍寶原石第一次出土是日本殖民統治臺灣時期，由原住民在都蘭山發現，為高70公分，寛30公分，長30公分的藍色半透明石頭，正式揭開東海岸山脈尋寶的熱潮。目前在東海岸山脈除偶爾可以撿到小原石外，原產礦脈已經停產。臺東縣自然史教育館的館藏臺灣藍寶原石高29.5公分，寛21公分，長21公分，是於民國87年購置。,臺東縣自然史教育館的前身是民國74年成立於臺東縣成功鎮三仙國小的貝殼陳列館，民國83年省立博物館以此為基礎，設立臺東縣自然史教育館，將原本的貝殼標本做有系統的整理、展示與研究，現有館藏557種的貝殼標本，同時增設礦物展示室，蒐集世界各地的海洋珍寶及礦石，結合了自然資源和教學的功能，是了解東海岸蘊藏珍貴海洋及山脈資源最好的教室。,886-8-9851960#19,臺東縣961成功鎮三仙里基翬路16號,961,自台東轉運站，搭乘興東客運（原鼎東客運海線）開往成功、靜浦的班車，於三仙國小站下車。詳細可參閱興東客運（原鼎東客運海線）時刻表自花蓮玉里火車站出發者，則可搭乘興東客運（原鼎東客運海線）前往成功鎮，於三仙國小站下車。詳細可參閱興東客運（原鼎東客運海線）時刻表從花蓮出發者，則可搭乘花蓮客運前往成功鎮，於三仙國小站下車。詳細可參閱花蓮客運時刻表,每週三至每週日上午  08:00-12:00及下午12:30-16:30(連續假開放參觀資訊請參酌臺東縣自然史教育館FB粉絲專頁),{},"{'PositionLon': 121.39382934570312, 'PositionLat': 23.120769500732422, 'GeoHash': 'wsn7d3h21'}",遊憩類,{},"免費參觀（學校及團體機關申請預約導覽服務,請於一周前上網、電話或行文申請）",提供茶水、Wi-Fi、導覽解說,臺東縣,2023-07-13T01:40:49+08:00,2023-07-13T02:10:57+08:00
C1_376540000A_000336,石雨傘,石雨傘介於八仙洞與三仙台之間，約位在台11線102公里處。長達1公里的海岬由海岸延伸至海中，屬於石灰石隆起的海蝕地形。海岬岸上原有數隻形狀如傘的海蝕岩柱，目前只剩一隻獨立，看起來像一把雨傘，因而被稱為石雨傘。石雨傘實際是一種平衡岩，由上下兩塊岩石堆疊，上方是較堅硬的珊瑚礁岩，下方則是較軟的礫岩，受到經年累月的風雨侵蝕，因為上下岩石的堅硬度不同，侵蝕的程度也不同，長期累積的結果，形成下細上寬的模樣，像極了一把撐開的傘。除了石雨傘外，海岬上還有海蝕門、壺穴等豐富的海蝕景觀，非常具有觀賞價值，遊客可於涼亭眺望，細細觀賞，並且聆聽海濤聲，別有一番情趣。石雨傘觀景亭旁有木棧步道可到達，站在海水清澈的小灣澳，從這裡看過去的石雨傘，彷如佇立在一頭鯨魚身上。,石雨傘遊憩區擁有豐富的海蝕景觀，石空鼻海岬上的石雨傘是其獨特之處，可選擇在休憩涼亭觀賞海蝕景觀，涼亭旁綠草如茵，伴隨海風吹拂，相當愜意，也可以往下走到海水清澈的小灣澳，這裡更接近孤絕獨立的石雨傘。,886-8-9281530,臺東縣961成功鎮台11線105.8公里路旁,961,搭乘公車：1.搭乘鼎東客運海線8101、8102、8105、8106、8119、8181次公車於石雨傘站下車，沿台11線南下方向行進約300公尺可至石雨傘遊憩區停車場。2.搭乘花蓮客運1127、1145次公車於石雨傘站下車，沿台11線南下方向行進約300公尺可至石雨傘遊憩區停車場。,全天候開放,{},"{'PositionLon': 121.40190124511719, 'PositionLat': 23.175020217895508, 'GeoHash': 'wsn7fdfhm'}",自然風景類,石雨傘休憩區設有停車場。,{},無,1、懸崖地形請勿靠近2、禁止採摘、獵捕野生動植物3、禁止隨意拋棄垃圾及汙染環境等行為4、禁止露營、烤肉,臺東縣,2023-07-13T01:40:49+08:00,2023-07-13T02:10:57+08:00
C1_376540000A_000338,東部海岸國家風景區管理處,東海岸國家風景區管理處自民國77年成立之後，積極對東部海岸地區進行經營管理與規劃的工作，東管處具有旅遊服務、解說教育和文化保存等多重功能，館內設置自然地質博物館、阿美族文化展示區、史前文化、鯨豚館，遊客服務中心有容納225人的多媒體簡報室，每日按時播放東海岸風光，一樓設有東海岸自然及人文環境資源展示室，介紹東海岸的各種特色，服務台可購得所有東海岸的自然與人文叢書，提供遊客更多的豐富資訊。東海岸國家風景區管理處背山面海，北望可見成功鎮和三仙台，南眺可看見綠島，四周景觀絕佳。,位於成功鎮都歷的東海岸國家風景區管理處，入口處在台11線126公里附近，是交通部管理整個花東海岸旅遊景點的大本營，許多臺東海岸線的觀光休閒設施，都是東管處努力規劃的成果，也是旅客獲得東海岸豐富旅遊資訊的最佳去處與旅遊據點。,886-8-9841520,臺東縣961成功鎮信義里新村路25號,961,搭乘公車：1.搭乘鼎東客運海線8101、8102、8103、8107、8119、8120、8125次公車於東管處站下車，沿東管處標示牌進入行進約500公尺可到達遊客中心。2.搭乘台灣好行東部海岸線於阿美族民俗中心下車，行進約300公尺可到達遊客中心。,周一至周五08：30~17：30,{},"{'PositionLon': 121.32462310791016, 'PositionLat': 23.02012062072754, 'GeoHash': 'wsn6by9vu'}",遊憩類,園區內有大型車及小型車停車場。,{},臺東縣,2023-07-13T01:40:49+08:00,2023-07-13T02:10:57+08:00
C1_376540000A_000340,新港(彩虹)瀑布,位於臺灣臺東縣成功鎮西側的新港瀑布又名彩虹瀑布、麻荖漏山瀑布，日治時期稱為「惟神瀧」，地理上屬臺灣海岸山脈東側新港山山麓，發源自標高為1682.3公尺的新港山，瀑布落差約200公尺，屬於新港溪流域。是臺灣少見的長瀑布，且為東部海岸瀑布落差之最，因而名列臺灣十大名瀑之一。  目前有鎮公所開闢的麻荖漏步道可以前往，步道入口有小型車停車場。進入步道之後會先在半山腰盤旋最後才下切到新港溪開始溯溪，大約需要四次的過溪路徑才能走到最接近瀑布的終點，過程中有拉繩過溪和拉繩攀岩以及林間小徑的不同路線，全程約四十分鐘到一個小時，終點是一座兩分岔的小瀑峽谷地形，可以抬起頭來遠觀新港瀑布，但無法繼續前進走到新港瀑布正下方。  前往瀑步的溪谷間巨石疊錯，溪水清澈，西岸原始林及蔓藤密佈，躺在雪白的傾斜岩石，恍置仙境。另外瀑布附近的生態景觀亦相當豐富，值得攀岩溯溪來此一遊。,瀑布落差約200公尺的新港瀑布是東臺灣有名的瀑布，因瀑布的高低落差之大，新港瀑布因此名列臺灣十大名瀑之一。遊客可從麻荖漏步道前往，因地形之故，遊客需上上下下地過溪和攀岩，但路途中和終點的壯麗景緻，都令人將疲勞拋到九宵雲外。,886-8-9851004,臺東縣961成功鎮三民產業道路前往山區路上,961,搭乘公車：搭乘鼎東客運海線8101、8102、8103、8107、8119、8120、8125次公車於三民國小站下車，接東18鄉道三民路至三民國小左轉富榮路，遇叉路右轉東16鄉道之三民產業道路，於豎有麻老漏步道指示牌之叉路，右轉上坡至麻荖漏步道入口後沿步道前往，不含步道至瀑布路程約6公里。建議租賃交通工具前往。,全天候開放,{},"{'PositionLon': 121.34336853027344, 'PositionLat': 23.13319969177246, 'GeoHash': 'wsn795r89'}",自然風景類,遊憩類,{},1.欲至新港瀑布下需要經過麻荖漏步道，途中需要攀高、溯溪，請將裝備備妥。2.若想遠觀新港瀑布，可在麻荖漏步道入口處白榕旁，就可清楚看見。,臺東縣,2023-07-13T01:40:49+08:00,2023-07-13T02:10:57+08:00
