ScenicSpotID,ScenicSpotName,DescriptionDetail,Description,Phone,Address,ZipCode,TravelInfo,OpenTime,Picture,Position,ParkingPosition,TicketInfo,Remarks,City,SrcUpdateTime,UpdateTime
C1_315080500H_000016,金樽,金樽可俯瞰海岸全景，包含金樽漁港、白沙灣海灘以及附近的山澗峽谷，讓秀麗的景色完全盡收眼底，而這裡以臺灣唯一正在形成的陸連島聞名，看似酒杯形狀的海灣，故取名為「金樽」，又因為形狀像船錨，也被稱為「錨島」或「錨狀礁」。金樽擁有綿延達3公里長的純淨又迷人的沙灘，旅人可至觀景休憩區觀海景、聽浪聲，近距離感受潔白浪花拍打岸邊的旖旎風情，或是在冬天約11-12月份時，來金樽漁港欣賞國際衝浪公開賽選手們駕馭海浪的英姿！遊玩金樽柔細的沙灘後，可回到觀景休憩區旁的咖啡店，喝上一杯香濃的麥飯石咖啡，十足愜意，也是人生一大享受。,金樽擁有臺灣唯一正在形成的陸連島，因看似酒杯，故取名為「金樽」，又因形狀像船錨，也被稱為「錨島」或「錨狀礁」。東管處在此地設有休憩區可俯瞰海岸全景，秀麗的海岸景色完全盡收眼底。,886-8-9841520,臺東縣959東河鄉七里橋11號,959,北上：由台東火車站前搭往成功、靜浦的鼎東客運海線班車，於金樽下車。南下：由花蓮火車站前搭往台東的花蓮客運海線班車，於金樽下車。詳細時刻表及車資請洽花蓮客運(查詢電話：03-8338146~8)或鼎東客運海線(查詢電話：089-328629 / 089-333443),全天候開放,"{'PictureUrl1': 'https://www.eastcoast-nsa.gov.tw/image/28914/640x480', 'PictureDescription1': '金樽'}","{'PositionLon': 121.27974700927734, 'PositionLat': 22.945100784301758, 'GeoHash': 'wsn4xc10y'}",{},免費,1.為了防止觀光人潮影響到地方環境，到訪的遊客應保持環境清潔，一同維護這塊淨土。2.於夏日天氣炎熱時，請做好防曬措施，以避免被烈日曬傷。,臺東縣,2023-07-13T01:40:49+08:00,2023-07-13T02:10:57+08:00
C1_315080500H_000028,加路蘭,加路蘭擁有一大片寬廣的草坪、休憩涼亭、解說站以及觀景台，不但提供了東海岸旅行的最佳休息站，這裡美麗的海岸景觀與獨樹一格的裝置藝術，成為熱門的拍照景點，旅人們可在海邊散步聽浪聲、吹海風，一邊迎著和煦陽光渡過悠閒時光，或是夜晚拜訪毫無光害的加路蘭，仰望浩瀚無垠的星空。來到加路蘭除了欣賞自然美景之外，區內也有不少由漂流木所組成的裝置藝術作品，其中有兩條魚矗立在海邊，取名為「我的好朋友」的裝置藝術作品，上面寫道：「歡迎過路的旅者，有一個輕鬆愉快的旅程！」其他還有「類窗櫺」、「日昇之舞」、「風車組」、「哭泣的露珠」等，連休憩涼亭中的裝飾也可見漂流木的蹤影，讓加路蘭成為最美的藝文海岸遊憩區。,加路蘭鄰近富岡地質公園(小野柳)，有寬廣的草坪、涼亭、解說站以及觀景台，是東海岸旅行的最佳休息站，區內延續著風化、海蝕景觀，海岸線條紋路特殊，草地上也有不少漂流木裝置藝術作品，是東海岸之旅必遊之地。,886-8-9281530,臺東縣950臺東市台11線157公里處,950,北上：由台東火車站前搭往成功、靜浦，或花蓮的鼎東客運、台灣好行海線班車，在加路蘭站下車。南下：由花蓮火車站前搭往台東的花蓮客運海線班車，在加路蘭站下車。詳細時刻表及車資請洽花蓮客運(查詢電話：03-8338146~8)或鼎東客運海線(查詢電話：089-328629 / 089-333443),全天候開放,"{'PictureUrl1': 'https://www.eastcoast-nsa.gov.tw/image/72378/640x480', 'PictureDescription1': '加路蘭遊憩區大地藝術作品「月亮住在海裡」'}","{'PositionLon': 121.1969985961914, 'PositionLat': 22.806499481201172, 'GeoHash': 'wsn1tzucq'}",文化類,{},免費,1.為了防止觀光人潮影響到地方環境，到訪的遊客應保持環境清潔，一同維護這塊淨土。2.園區內四周沒有樹木遮陰，因此夏日天氣炎熱時，請做好防曬措施，以避免被烈日曬傷。3.冬季東北季風強...,臺東縣,2023-07-13T01:40:49+08:00,2023-07-13T02:10:57+08:00
C1_315080500H_000032,富岡地質公園 (小野柳),富岡地質公園 (小野柳) 位於富岡漁港北方的海域，是東部海岸最南端的風景據點，因地形和岩石在種類上，與北關的野柳外貌相似，因此被稱為「小野柳」。園區內設有遊客中心、賣店、露營區與海邊步道等，來到這裡除了欣賞不同類型的奇岩怪石、觀海聽浪、賞魚戲水之外，天氣晴朗時更能眺望約33公里外的綠島，在此露營體驗在夜色下聽著海聲入睡的新奇感受。海洋與地殼變動創造出的瑰麗地景經過地殼抬升與海洋千年侵蝕沖刷下，造就了壯觀吸引旅人眼光的豆腐岩、蜂窩岩，而因岩層風化打造出各種奇岩怪石，其中以大眼蛙、駱駝石、龜陣岩最為著名，是來富岡地質公園 (小野柳) 必拍的地景之一。夜訪小野柳每年5月至10月時，便會推出「夜訪小野柳」的活動，透過解說志工精采的導覽，不僅帶領遊客認識富岡地質公園 (小野柳) 的夜間生態環境，還能看見生存於富岡地質公園 (小野柳) 的寄居蟹，讓人發掘入夜後富岡地質公園 (小野柳) 另一面風貌，同時透過這場活動，募集空殼幫忙寄居蟹找一個家。,位於富岡漁港北方海域，是東部海岸最南端的風景據點，因為地形和岩石在種類上，與北海岸的野柳外貌相似，因此被稱為「小野柳」。天氣晴朗時，從富岡地質公園 (小野柳)可以清楚地看見約33公里外的綠島，以及富岡漁港出航蘭嶼的交通船！,886-8-9281530,臺東縣950臺東市松江路一段500號,950,北上：由台東火車站前搭往成功、靜浦，或花蓮的鼎東客運、台灣好行海線班車，在小野柳站下車。南下：由花蓮火車站前搭往台東的花蓮客運海線班車，在小野柳站下車。詳細時刻表及車資請洽花蓮客運(查詢電話：03-8338146~8)或鼎東客運海線(查詢電話：089-328629 / 089-333443),全天候開放,"{'PictureUrl1': 'https://www.eastcoast-nsa.gov.tw/image/72369/640x480', 'PictureDescription1': 'IY030184_調整大小'}","{'PositionLon': 121.19599914550781, 'PositionLat': 22.795400619506836, 'GeoHash': 'wsn1tvu0z'}",{},大型車：假日200元、非假日170元；小型車：假日60元、非假日50元；機車：假日20元、非假日15元,1.為了防止觀光人潮影響到地方地質環境，到訪的遊客應保持環境清潔，一同維護這稀有的地質景觀。2.於夏日天氣炎熱時，請做好防曬措施，以避免被烈日曬傷。3.到此聽海、玩水或釣魚的遊客，...,臺東縣,2023-07-13T01:40:49+08:00,2023-07-13T02:10:57+08:00
C1_315080500H_000034,都蘭,都蘭是東部海岸南段最大的部落，聳立東台灣的都蘭山，向來是部落族群景仰的「聖山」，不只是民俗、藝術與文化的精神象徵，同時也是遊客可以享受山林野趣的好去處！近來阿美族部落致力推動社區文化，使得歌謠舞蹈更顯精湛，手工藝品亦見創新精緻，而保有清新健康的阿美族風味美食，更是頗值一試。都蘭地區不只擁有縣定遺址「都蘭遺址」、海岸潮間帶及深具阿美族部落特色的生態，更有「水往上流奇觀」、電影「月光下 我記得」拍攝地-「月光小棧」、美麗的海灣「加母子灣」、紅糖文化藝術館「新東糖廠」，還有好山（都蘭聖山）、好水（太平洋）等景點，提供訪客充滿樂趣與驚奇的旅程！東管處沿著台11線興建幾座涼亭，使遊客能從不同角度瞭望都蘭灣之美，仲夏夜遊客在滿天星空下，享受都蘭灣美不勝收的景色！,都蘭是東部海岸南段最大的部落，聳立東台灣的都蘭山，向來是部落族群景仰的「聖山」，都蘭地區除了擁有縣定遺址「都蘭遺址」、海岸潮間帶及極具特色的阿美族部落文化外，在好山（都蘭聖山）、好水（太平洋）映襯下，提供訪客充滿樂趣與驚奇的旅程！,886-8-9896200,臺東縣959東河鄉都蘭,959,北上：由台東火車站前搭往成功、靜浦，或花蓮的鼎東客運、台灣好行海線班車，在接近漁橋處下車或在都蘭站下車，循指標即可抵達。南下：由花蓮火車站前搭往台東的花蓮客運海線班車，在接近漁橋處下車或在都蘭站下車，循指標即可抵達。詳細時刻表及車資請洽花蓮客運(查詢電話：03-8338146~8 )或鼎東客運海線(查詢電話：089-328629 / 089-333443),全天候開放月光小棧：星期三、日 休息 / 星期一、二、四、五、六 11:00–17:00,"{'PictureUrl1': 'https://www.eastcoast-nsa.gov.tw/image/247/640x480', 'PictureDescription1': '這是都蘭糖廠全景'}","{'PositionLon': 121.22605895996094, 'PositionLat': 22.871919631958008, 'GeoHash': 'wsn4nedne'}",{},免費,為了防止觀光人潮影響到部落的安寧，或帶來文化的摩擦，到訪的遊客應尊重當地文化，保持環境清潔，一同維護這塊淨土。,臺東縣,2023-07-13T01:40:49+08:00,2023-07-13T02:10:57+08:00
C1_315080500H_000035,成功新港漁港,"成功鎮以前為「麻荖漏社」，1921年日人改為「新港」，戰後改為「成功」，距今3,500年前之麒麟文化，以成功鎮之出土文物為最，可知此地起源甚早。成功新港漁港是東海岸地區最大的漁港，漁港面臨太平洋，是黑潮暖流經過的海域，鬼頭刀、旗魚、鰹魚等豐富的海洋資源，造就了成功獨特的鏢旗魚技藝，以及漁業文化的蓬勃發展。當每年10月吹起東北季風時，正是旗魚的盛產季節，漁民鏢旗魚的獨到技藝，讓旗魚肉質保留了鮮Q的口感，深受各地老饕的喜愛，紛紛來成功飽啖美味的旗魚大餐！黑潮暖流經過的成功，也是賞鯨的好地方！搭乘賞鯨船乘風破浪，遙望美麗的東海岸島嶼之餘，還有機會欣賞到海豚成群在海中跳躍，那美麗的時刻總是令人難以忘懷。除了賞鯨、冬天大啖旗魚之外，成功鎮上還有各種特色小吃、伴手禮，多汁的鬼頭刀魚排、綿密的成功豆花、用當地食材製作的手工餅等等，都是來成功不可錯過的美食喔！",成功漁港為東部海岸地區最大的漁港，面臨太平洋，同時又有黑潮暖流經過，因此水產資源相當豐富。主要的魚類產量為鰹魚、旗魚、鬼頭刀、鮪魚、柴魚等，每天下午3點左右是新港漁港的鮮魚拍賣會，來此可感受漁民們此起彼落的拍賣聲，想要品嚐新鮮魚貨的遊客更是不可錯過哦！,886-8-9851004,臺東縣961成功鎮港邊路19號,961,北上：由台東火車站前搭往成功、靜浦，或花蓮的鼎東客運或台灣好行海線班車，於成功鎮下車。南下：由花蓮火車站前搭往台東等地的花蓮客運海線班車，於成功鎮下車。詳細時刻表及車資請洽花蓮客運(查詢電話：03-8338146~8 ),全天候開放,"{'PictureUrl1': 'https://www.eastcoast-nsa.gov.tw/image/28792/640x480', 'PictureDescription1': '親潮和黑潮兩股暖流在此經過，造就了成功漁港豐富的水產資源'}","{'PositionLon': 121.37684631347656, 'PositionLat': 23.103200912475586, 'GeoHash': 'wsn73vzcv'}",{},免費,1.成功鎮商家林立，建議遊客可以預留較多時間在此地用餐、購物，並體驗具特色的東海岸海港風情,臺東縣,2023-07-13T01:40:49+08:00,2023-07-13T02:10:57+08:00
C1_315080500H_000038,烏石鼻,烏石鼻位於長濱鄉南方寧埔村一片伸入海中的岬角，因遠看像人的鼻子向外突出而命名。迷人的烏石鼻擁有為全台灣面積最大的柱狀火山成岩體，突出於海中的黝黑岩體，便是火山活動熔岩噴發的產物。烏石鼻四周有著多樣化的潮間帶生態與海蝕地形，加上海域附近有豐富的浮游生物和魚，更是成為東海岸磯釣和潛水的天堂，尤其每年2月釣白毛的季節，更可見到沿岸佈滿釣客，人手一竿享受釣魚樂趣的盛況。,烏石鼻位於台東縣長濱鄉南方寧埔村一片伸入海中的岬角，是火山活動熔岩噴發的產物，是全台灣面積最大的柱狀火山成岩體。岩體上遍佈大大小小的潮池、海蝕溝等，居民會趁著退潮時前來撿拾海螺、海瓜子等，此時除了生態觀察外，亦是體驗長濱鄉人文風貌的好時機。,886-8-9281530,臺東縣962長濱鄉介於長濱與石雨傘間，約在台11線97.5公里處,962,南下：由花蓮火車站前搭往成功、台東等地的花蓮客運海線班車，在烏石鼻下車。北上：由台東火車站前搭往靜浦、花蓮的鼎東客運、台灣好行海線班車，在烏石鼻下車。詳細時刻表及車資請洽花蓮客運(查詢電話：03-8338146~8)或鼎東客運海線(查詢電話：089-328629 / 089-333443),全天候開放,"{'PictureUrl1': 'https://www.eastcoast-nsa.gov.tw/image/28936/640x480', 'PictureDescription1': '烏石鼻獨特的地質地貌'}","{'PositionLon': 121.41744995117188, 'PositionLat': 23.227689743041992, 'GeoHash': 'wsnk4umrp'}",{},免費,1.颱風或豪雨季節易有巨浪，請遊客注意安全2.於海濱遊憩請穿著舒適膠鞋，並特別小心足下濕滑3.烏石鼻港為重要漁獲地，推薦遊客在此享用海鮮大餐,臺東縣,2023-07-13T01:40:49+08:00,2023-07-13T02:10:57+08:00
C1_315080500H_000042,阿美族民俗中心,阿美族民俗中心位於東管處都歷處本部旁，佔地約2公頃，園區中設有戶外表演廣場、可供2千人觀賞的戶外看台、射箭體驗區、阿美族傳統家屋等，並目前由Amis旮亙樂團做經營，讓遊客前來當神射手、DIY製作阿美族串珠、傳統樂器排笛，或是欣賞阿美族傳統歌舞表演，不僅成為體驗阿美族文化的好去處，也是親子景點遊樂的好地方。阿美族民俗中心在西元1995年（民國84年）11月興建完成，主要建築之祭屋及家屋，是依據日本民族學家千千岩助太郎在西元1943年（民國32年）於花蓮縣光復鄉調查的手繪圖，仿造花蓮縣太巴塱社的祭司住家搭建，走訪這裡，可看出阿美族特有的居住文化。除了逛逛特色建築，了解阿美族的建築之美以外，民俗中心還有部落文物展、手工藝品、特產展售、美食服務等，最後也不容錯過定時的免費展演，嘹亮的歌聲，搭配以阿美族特有的旮亙（竹鐘）、鼻笛等樂器演奏，重現了阿美族最原味的音樂，下次若有機會拜訪時，不妨等候一下，來欣賞Amis旮亙樂團的表演吧！,位於都歷區內的阿美族民俗中心於1995年11月興建完成，走訪這裡，可看出阿美族特有的居住文化，除了阿美族特色建築外，遊客在此還可進行拉鞦韆、射箭及竹炮等阿美族文化體驗，還有「Amis旮亙樂團」定點表演：舞蹈、歌唱、打擊樂器、排笛、鼻笛等，歡迎一起來唱跳。,886-8-9841751,臺東縣961成功鎮新村路25號,961,北上：由台東火車站前搭往成功、靜浦，或花蓮的鼎東、花蓮客運海線班車，於東管處都歷處本部站下車。南下：由花蓮火車站前搭往台東等地的花蓮、鼎東客運海線班車，於東管處都歷處本部站下車。詳細時刻表及車資請洽花蓮客運(查詢電話：03-8338146~8)或鼎東客運海線(查詢電話：089-328629 / 089-333443),週一、二、四、五、六、日 09:00~17:00；週三休園,"{'PictureUrl1': 'https://www.eastcoast-nsa.gov.tw/image/28800/640x480', 'PictureDescription1': '阿美族民俗中心'}","{'PositionLon': 121.32550048828125, 'PositionLat': 23.017789840698242, 'GeoHash': 'wsn6by683'}",{},定期展演自由樂捐，其他項目請參考網頁底下 ''旅遊叮嚀',展場開放時間： 09:00~17:00；週三固定休園展演活動時間：● 週一、二、四、五、六：11:00、14:00 定時展演(兩場)● 週日：上午演出(預約制)；下午14:00、1...,臺東縣,2023-07-13T01:40:49+08:00,2023-07-13T02:10:57+08:00
C1_315080500H_000101,國家人權博物館-白色恐怖綠島紀念園區,「白色恐怖綠島紀念園區」原為「綠島人權文化園區」，現址為台東縣綠島鄉公館村將軍岩20號，土地面積約32公頃，位於綠島東北角。園區內歷經火燒島浮浪者收容所、新生訓導處、綠洲山莊等不同時期的監獄文化，為威權政府實施重大人權侵害發生地。整個園區的建築群、自然、生態景觀表現長期人群與自然互動的過程，將各種型態的文化資產及地景結合成一文化景觀。 戒嚴時期「白色恐怖綠島紀念園區」為軍事、政治、治安案件之羈押的場所；1951年至1970年間之新生訓導處時期，1972年至1987年間之綠洲山莊時期（國防部感訓監獄時期），其中綠洲山莊乃因應1970年泰源事件而興建之高牆封閉式監獄，與新生訓導處時期之空間型態差異大。「白色恐怖綠島紀念園區」在台灣人民爭取人權發展的歷史中，具有特殊意義。每個時代都有屬於自己的無奈與悲歌，白色恐怖綠島紀念園區誕生於政治敏感時期，過去為專用以囚禁政治犯和思想犯。白色恐怖綠島紀念園區位在綠島的公館村的將軍岩前方，占地極廣，涵蓋將軍岩、人權紀念公園、綠洲山莊、莊敬營區等，其中的綠洲山莊、新生訓導處便是進行感化教育、思想改造的地方。一踏入園區中，便能感受當時的沉重又壓抑的氛圍，是認識昔日台灣白色恐怖、人權發展歷史的好去處。綠洲山莊綠洲山莊過去為國防部綠島感訓監獄，1972年完工後，陸續將泰源監獄與各地軍事監獄中的思想犯遷置於此，並完全保留了昔日高聳的圍牆、鐵絲網、操場、禮堂、八卦樓、禁閉室和52間大小牢房。在綠洲山莊前的右方洞口名為鬼門關，原是過去進入綠洲山莊必經之處，過了鬼門關後即是綠洲山莊，意味著生還機會渺茫。走進綠洲山莊，山莊內展示許多白色恐怖時期相關史料，窄小的監獄、幽暗沉重的氛圍籠罩著，即使在多年後的現在，那份沉重仍然在其中揮之不去。新生訓導處民國39年（1950）初期，由於台灣各地監獄的政治犯人滿為患，大部分被送往綠島，接受無止盡的勞動與思想改造，因此新生訓導處成為最大的勞改集中營。現在的新生訓導處重現了過去的中隊房舍、上課區、廚房等，踏入房間可以看見栩栩如生的蠟像，在不大的寢室（囚室）中約住了120至160人，每個人必須輪流相疊側睡，甚至難以翻身，讓人真實感受當時他們的難受與不公平對待，並只能運用就寢前短短的一小時，來寫家書、下象棋、拉小提琴或胡琴，稍稍釋放身心所承受的壓抑。綠島人權紀念公園公園內的紀念碑與不平坦的草原以潛入地下的設計，代表著當時被埋沒地底下的黑暗時期與不平等待遇，而人權紀念碑象徵著對新時代免於恐懼之自由的追求，特別選在民國88年（1999）國際人權日動工，又稱為「綠島垂淚碑」，螺旋狀的結構在下雨時，雨水會由兩旁的集水渠彙集流入中心的點，就像是流淚一般。在旁邊碑文，名為:「垂淚碑」。上面有著名作家柏楊所題的碑文：「在那個時代，有多少母親，為她們被囚禁在這個島上的孩子，長夜哭泣。」短短的28個字卻道盡了那個時代的苦難。,位於綠島的公館村的將軍岩前方，涵蓋人權紀念碑公園、綠洲山莊等。山莊內展示許多白色恐怖時期相關史料，每一段記載都是深刻見骨的歷史傷痕。為紀念過去臺灣人權運動發展而犧牲的人們，1996年設立人權紀念公園，2018年更名為白色恐怖綠島紀念園區。,886-8-9671095,臺東縣951綠島鄉將軍岩20號,951,北上：自台東火車站前搭乘台灣好行東部海岸線或鼎東客運海線班車，在富岡漁港站下車後步行至富岡漁港，轉乘渡船前往綠島。南下：於花蓮火車站前搭乘花蓮客運，往豐濱、靜浦或台東方向班車，在富岡漁港站下車後步行至富岡漁港，轉乘渡船前往綠島。詳細時刻表及車資請洽花蓮客運(查詢電話：03-8338146~8)或鼎東客運海線(查詢電話：089-328629 / 089-333443)綠島：島上設...,每日09:00-17:00,"{'PictureUrl1': 'https://www.eastcoast-nsa.gov.tw/image/29023/640x480', 'PictureDescription1': '白色恐怖綠島紀念園區入口處'}","{'PositionLon': 121.49626159667969, 'PositionLat': 22.675180435180664, 'GeoHash': 'wsn2uxyuk'}",{},免費,1.園區內展示史料資料，請懷著莊重的心情感受過去，珍惜現在2.愛護大自然生物，並請維護環境整潔3.夏季日照與冬季寒風甚強，請預作防範4.僅限10人以上提供團體預約、其他則為固定時段...,臺東縣,2023-07-13T01:40:49+08:00,2023-07-13T02:10:57+08:00
C1_315080500H_000102,牛頭山、樓門岩,綠島東北方海岬的牛頭山是綠島地標，牠靜靜地趴臥在東北岬，守望著綠島以及每位到來的旅客。從南寮漁港往北走，沿途經過綠島遊客中心、柴口、綠洲山莊等景點，就可抵達牛頭山。牛頭山三面環海，山頂是一大片碧草如茵的大草原，最適合賞海、觀汐，賞夕照的地方；牛頭山的夕照也是綠島絕佳的景色之一，有別於朝日溫泉與綠島燈塔平地觀賞夕陽的景色，從高處俯瞰牛頭山的夕照，欣賞著夕陽緩緩落到另一端的中央山脈，進而消失不見，感受不同的蕭瑟美感。牛頭山可遙望樓門岩，樓門岩位於綠島東北角海岸外約300公尺處，是一連串突出海面小珊瑚礁岩塊群，而其中最高大一塊經過海浪擊打侵蝕，中央地方貫穿成圓洞，由綠島遠遠望去，像拱門一樣，因此被稱為「樓門岩」，是綠島最具代表性的海蝕洞穴；動力船可以從中駛過，抬頭欣賞震撼人心的海蝕洞，或是俯瞰變化多端的海底地型，與海浪拍打礁岩的夏日美景。,綠島東北方海岬的牛頭山是綠島地標，三面環海，山頂是一大片草原，是最適合賞海、觀汐、夕照之處。從牛頭山可遙望樓門岩，樓門岩位於綠島東北角海岸外約300m處，是一連串突出海面小珊瑚礁岩塊群，是綠島最具代表性的海蝕洞穴。,886-8-9672026,臺東縣951綠島鄉環島公路6公里處,951,南下：於花蓮火車站前搭乘花蓮客運，往豐濱、靜浦或台東方向班車，在富岡漁港站下車後步行至富岡漁港，轉乘渡船前往綠島。北上：自台東火車站前搭乘台灣好行東部海岸線或鼎東客運海線班車，在富岡漁港站下車後步行至富岡漁港，轉乘渡船前往綠島綠島：島上設有環島公車，以南寮為起點環島一周(查詢電話：089-672510)。,全天候開放,"{'PictureUrl1': 'https://www.eastcoast-nsa.gov.tw/image/29058/640x480', 'PictureDescription1': '樓門岩是一連串突出海面小珊瑚礁岩塊群'}","{'PositionLon': 121.5076675415039, 'PositionLat': 22.67675018310547, 'GeoHash': 'wsn3hbpjt'}",{},免費,1、天候不佳時切勿下海，參與潛水活動請接洽當地合法潛水商家，並聽從教練指示活動，勿單獨前往。2、於牛頭山眺望海景時，小心海風強勁，請勿靠近懸崖邊。3、愛護大自然生物，並請維護環境整...,臺東縣,2023-07-13T01:40:49+08:00,2023-07-13T02:10:57+08:00
