ScenicSpotID,ScenicSpotName,DescriptionDetail,Description,Phone,Address,ZipCode,TravelInfo,OpenTime,Picture,Position,ParkingPosition,TicketInfo,Remarks,City,SrcUpdateTime,UpdateTime
C1_376540000A_000221,布農族文化館,布農族文化館位於南橫公路東段入口處，於2002年2月2日開館，為一棟樓高三層，面積廣達1.37公頃，外觀雄偉頗富原住民文化色彩之建築。走進建築的內部，會發現裡面的設備相當多元，一樓為海端鄉南橫東段遊客服務中心，提供旅遊諮詢；二樓為特展區，每年固定辦理四場特展。三樓為海端鄉布農故事館及視聽教室，展示各種布農族工藝製品及傳統生活用品，如木雕、織布、陶器、木頭蒸桶、藤編飯盒等種類豐富，可自行免費入館參觀，也可預約導覽人員為遊客做專業的解說；三樓有視聽室做為各項研習會議場地。另外館外有表演廣場，提供布農族慶典文化活動重要場所。文化館的旁邊有座充滿布農族風格的天橋，可通往布農傳統文化體驗區，園區內有布農族傳統屋五間，包括利稻社、久良社、中心崙社、梅蘭社、卡內灣社等設施，提供遊客參觀休憩之場所。文化館除了是保存布農文化的寶地，也是布農文化傳承的重要據點，結合開發文化、農業與休閒產業，是目前文物館積極推動以及活絡改善本館營運計畫的重要目標。所以遊客若想更加了解布農族的歷史人文，來一趟布農族文物館是非常值回票價的旅遊選擇！,布農族文化館位在臺東縣海端鄉，是座豐富內容的原住民文化館，將活躍於山林間的高山原住民—布農族的一切鉅細靡遺地收藏在這裡。不論館內一到三樓的原住民文化展示還是戶外的文化體驗區，都有設計了方便瀏覽的展區空間，讓遊客能更自在的參觀、休憩，實際感受到布農族傳統的生活方式。,886-8-9931638,臺東縣957海端鄉海端村山平2鄰56號,957,搭乘火車：搭乘臺鐵至關山車站，轉搭乘東台灣客運8178次公車(往利稻)於海端站下車，往南下方向行進約250公尺後右轉續行約50公尺即到達。搭乘公車：搭乘東台灣客運8161、8163、8165、8166、8167次公車於關山站下車，轉搭乘東台灣客運8178次公車(往利稻)於海端站下車，往南下方向行進約250公尺後右轉續行約50公尺即到達。,周三至周日09:00-16:30，週一、二休館,{},"{'PositionLon': 121.17584991455078, 'PositionLat': 23.098350524902344, 'GeoHash': 'wsn5mkvt9'}",{},免費參觀,可來電預約導覽,臺東縣,2023-07-13T01:40:49+08:00,2023-07-13T02:10:57+08:00
C1_376540000A_000223,栗松溫泉,栗松溫泉位於標高1075m的新武呂溪支流峽谷，是一處尚未開發的野溪溫泉，溫泉源頭來自岩壁，屬於瀑布型溫泉。栗松溫泉的水溫約45-65度，酸鹼值約pH7，屬於弱鹼性的碳酸泉。要到達栗松溫泉過程並不輕鬆，於台20號道(南橫公路)約169公里處轉入雜貨店旁小路往登山口前進，到達登山口後須徒步約40分鐘，除前段緩下坡之外，有約900公尺的陡下切路段需要克服，下切至河谷後須溯溪或攀爬石頭至栗松溫泉位置。前往栗松溫泉建議於枯水期前往，並注意自身安全。,通過陡峭的山路，溯過激烈的溪流之後才會到達如同仙境一般美麗的栗松溫泉。栗松溫泉，有著從山壁傾流而下的泉水瀑布，水溫45-65℃左右，屬於弱鹼性的碳酸氫鈉泉。山壁上凝結了碳酸鈣結晶，加上附著在礦物上的翠綠溫泉藻形成的色彩，如同翡翠鑄成的岩壁，是此地最著名的景觀。,886-8-9931346,臺東縣957海端鄉南橫公路利稻附近東段新武呂溪上游河谷,957,栗松溫泉登山口附近無公車到達，建議租賃交通工具沿台20號道於169.5公里旁雜貨店小路進入。進入栗松溫泉需要登山、溯溪，從入口至溫泉來回需要至少兩個小時，十分考驗體力，請自行斟酌自身能力。,全天候開放（11月～4月為枯水期）,{},"{'PositionLon': 121.03720092773438, 'PositionLat': 23.19791030883789, 'GeoHash': 'wsn5fr09e'}",溫泉類,自然風景類,{},1.雨季時不適合造訪栗松溫泉，水位高、溪流急，最好不要冒險溯溪。2.通往此秘境的路途多險，能有熟悉此路的嚮導帶領是最好。3.請勿將美麗的崖壁刮下帶回，這是大家的公有財產，要好好保護...,臺東縣,2023-07-13T01:40:49+08:00,2023-07-13T02:10:57+08:00
C1_376540000A_000224,碧山溫泉,碧山溫泉位處霧鹿峽谷段新武呂溪下切溪谷，與公路落差60公尺，形成長長的峽谷景觀，氣勢不凡，地形險峻，兩岸皆有溫泉，從霧鹿橋畔的小路直溯溪邊，河床上處處冒著蒸氣，溫泉露頭隨處可見，非常明顯易訪，但得徒步半個小時以上，後段幾乎垂直需要靠繩索攀降90度的陡坡，前往泡湯必須有心理準備。 碧山溫泉常被誤為霧鹿溫泉，兩座溫泉事實上都位於新武呂溪谷中的溫泉區內，屬碳酸氫鈉泉，溫度攝氏40~65度左右，清澈透明，無色無味。碧山溫泉與栗松溫泉、彩霞溫泉、轆轆溫泉、霧鹿溫泉，都是海端鄉境內的著名溫泉區，泡湯之外可順道造訪霧鹿村，溫泉區內有鐘乳石可賞，再加上自然風景，彷如人間天堂。,由於碧山溫泉圍繞在翠山藍天之下，因而取名為碧山溫泉，是工業技術研究院探勘挖掘出的良泉，溫泉不斷的從岩縫中湧出來，最大特色是在溪畔就有天然蒸氣浴，讓遊客盡情享受天然的三溫暖。許多想要泡湯的遊客在假日時紛紛出現，讓熱氣騰騰的碧山溫泉更添熱鬧氣氛。,886-8-9931370,臺東縣957海端鄉新武呂溪上游(南溪),957,搭乘火車：搭乘臺鐵於關山站下車，可轉搭乘東台灣客運8178次公車(往利稻)於天龍橋站下車，往台20號道西行方向行進約1公里，可到達碧山溫泉休閒農莊。搭乘公車：搭乘東台灣客運8178次公車於於天龍橋站下車，往台20號道西行方向行進約1公里，可到達碧山溫泉休閒農莊。野溪溫泉的碧山溫泉位於六口溫泉與碧山溫泉休閒農莊之間，需要下切溪谷、溯溪，未事先準備請勿前往。,全天候開放,{},"{'PositionLon': 121.02931213378906, 'PositionLat': 23.176000595092773, 'GeoHash': 'wsn5f54cg'}",溫泉類,{},1.碧山溫泉屬野溪溫泉，前往需要下切溪谷及溯溪，請預先做好準備。2.若單純想體驗泉質，可前往相同源泉之六口溫泉及相關旅宿。3.前往台20號道之大眾運輸班次較少，請事先確認行程時刻表...,臺東縣,2023-07-13T01:40:49+08:00,2023-07-13T02:10:57+08:00
C1_376540000A_000227,初來抗日紀念碑,日本殖民統治臺灣時，當局為鎮壓新武呂溪布農族人抗日行動，修築新武路至薩苦社間警備道，在薩古薩Sah-sah山上設立砲台，配有三英吋連射砲、十二吋及七吋山砲各一門、重機槍一挺，居高臨下，虎視眈眈，藉以控制新武呂溪沿線附近布農族原住民的動態。鎮壓布農族人的抗日行動。初來抗日紀念碑已不復見肅殺的氛圍，反而因為位置絕佳，可將縱谷之美盡收眼底，四周景色，遊客除可感受紀念碑上訴說的歷史故事外，更可駐足盡享美麗的山川景色。,初來抗日紀念碑位在初來部落東南方新武呂溪畔，關山大圳引水處，是為紀念布農族好漢在日本殖民統治台灣期間抗日的英勇事績，由海端鄉公所設立，與拉瑪達星星紀念公園和逢坂抗日紀念碑，同為海端鄉境內紀錄布農族抵抗日本殖民統治的三大景點。,886-8-9931370,臺東縣957海端鄉初來部落東南方新武呂溪畔,957,搭乘火車：搭乘臺鐵至關山車站，可轉搭乘東台灣客運8178次往利稻方向公車於初來站下車，沿台20號道往東行方向行進約500公尺可到達。搭乘公車：搭乘東台灣客運8161、8163、8166、8178次公車於初來站下車，沿台20號道往東行方向行進約500公尺可到達。初來抗日紀念碑位於關山大圳內。,24小時全年無休,{},"{'PositionLon': 121.1732406616211, 'PositionLat': 23.116670608520508, 'GeoHash': 'wsn5t278m'}",{},臺東縣,2023-07-13T01:40:49+08:00,2023-07-13T02:10:57+08:00
C1_376540000A_000228,逢坂抗日紀念碑,逢坂抗日紀念碑是為紀念布農族人於1919年反抗日本殖民統治台灣當局高壓統治興建的紀念碑，為約1.5公尺高的石柱，與拉瑪達星星紀念公園和初來抗日紀念碑，同為海端鄉境內紀錄布農族抵抗日本殖民統治的三大景點。逢坂抗日紀念碑附近的南橫森林，蓊鬱蒼綠，層巒疊翠，利稻與轆轆之間長達9公里的新武呂溪峽谷，從橫切面來看，整個峽谷呈現S型，山群在此形成大斷崖，鬼斧神工，氣勢險峻磅礡，峽谷景觀壯觀，天龍吊橋橫跨霧鹿溪，在青山翠谷中宛如一道彩虹，是令人難以忘懷的南橫第一美景，也是戶外活動的好去處。,逢坂抗日紀念碑是為紀念布農族人於1919年反抗日本殖民統治台灣當局高壓統治興建的紀念碑，為約1.5公尺高的石柱，與拉瑪達星星紀念公園和初來抗日紀念碑，同為海端鄉境內紀錄布農族抵抗日本殖民統治的三大景點。,886-8-9551637,臺東縣957海端鄉台20號道201.5公里處,957,搭乘火車：搭乘臺鐵至關山車站，可轉搭東台灣客運8178次公車(往利稻)於新武呂下車，往台20號道東行方向續行約1.7公里可到達。搭乘公車：搭乘東台灣客運8178次公車(往利稻)於新武呂下車，往台20號道東行方向續行約1.7公里可到達。,24小時全年無休,{},"{'PositionLon': 121.14044189453125, 'PositionLat': 23.133699417114258, 'GeoHash': 'wsn5se7g8'}",{},臺東縣,2023-07-13T01:40:49+08:00,2023-07-13T02:10:57+08:00
C1_376540000A_000229,嘉明湖,"位在南部橫貫公路、向陽北方，直線約7公里的高山湖泊嘉明湖，是一座被譽為「高山藍寶石」、「天使的眼淚」的橢圓形湖泊。由翠綠的森林植被所環繞，清澈的湖面映照著天空的湛藍，深不可測，彷若人間仙境般的靜謐。傳說中嘉明湖的形成，是因隕石撞擊地球表面後造成的隕石坑，相當罕見。向陽上方的嘉明湖是臺灣第二高的高山湖泊，僅次於雪山翠池。湖面呈橢圓形，長約120公尺，寬約80公尺，深約6公尺，標高約3,310公尺。要上嘉明湖之前，必須到向陽國家森林遊樂區裡的向陽派出所辦理登山手續，才能確保自身安全。走出向陽森林遊樂園之後，沿途會經過雙橋登山口、三樹椅休息區、向陽山屋、好好池(黑水塘)營地、稜線、玉山圓柏、向陽大崩壁、向陽山登山口、嘉明湖避難小屋、向陽山交叉口、向陽山北峰、三叉山登山口、三叉山交叉口，最後抵達嘉明湖。此趟登山行程約需花費三天時間，向陽山屋、好好池(黑水塘)營地、稜線營地和嘉明湖避難小屋是這山上可以棲身的地方。沿途隨著海拔上升，針闊葉混合林轉為針葉林，針葉林轉為高山草原，夜晚又有星空滿天，景色變換交錯，精采絕倫。草原遼闊茫茫，嘉明湖活像一顆嵌在無邊綠絨上的絕色藍寶石，耀眼奪目，光采動人。嘉明湖附近森林與草原也是水鹿棲息的地方，幸運的話，或許你也能有機會與水鹿親近嬉戲。 雖然路途艱辛，耗費體力，如此動人佳景依然無法令人輕言放棄。",嘉明湖步道路線：向陽派出所辦理登山手續→雙橋登山口→三樹椅休息區→向陽山屋→好好池(黑水塘)營地→稜線營地→玉山圓柏→向陽大崩壁→向陽山登山口→嘉明湖避難小屋→向陽山交叉口→向陽山北峰→三叉山登山口→三叉山交叉口→嘉明湖→下山→向陽派出所辦理離山手續。,886-8-9324121#711 0912103375,臺東縣957海端鄉南橫公路三叉山東側,957,嘉明湖為國家景觀管制區，建議自行開車或租賃汽車沿台20號道(南橫公路)至向陽國家森林遊樂區，往嘉明湖的登山口位於此處。,天黑後禁止通行（路程約三天兩夜）,{},"{'PositionLon': 121.0341567993164, 'PositionLat': 23.29323959350586, 'GeoHash': 'wsnhd0qku'}",自然風景類,{},1、採總量管制2、須入山許可證3、入住山屋需收費4、切勿餵食水鹿，以免改變了牠們的飲食習慣5、請勿在水源地使用洗髮精、沐浴乳等任何清潔用品，以免造成汙染6、不得丟棄任何不屬於山林的...,臺東縣,2023-07-13T01:40:49+08:00,2023-07-13T02:10:57+08:00
C1_376540000A_000230,新武路峽,「新武」在布農族語代表「兩溪交會處」之意，也就是新武呂溪與大崙溪交會點，蜿蜒而下經卑南溪入海。海端係指今鄉公所所在地海端村， 布農語原稱haitotowan（現名haiduan）， 意指三方為山所環繞、一方為開口之地形。新武路峽由初來至嘉寶，是沈積頁板岩受壓力形成岩板後，夾入結晶石灰岩，經萬年蘊育而成的大理石岩盤，新武路溪與大崙溪交會流經其間，流切割沖刷形成景色壯闊的峽谷景觀，冬天時粗獷壯闊的光禿峰巒，彷若山水潑墨畫，在嚴冬過後往往呈現出一片褐色的光禿景緻，而有「台東赤壁」美譽，如遇下雪，景色更為賞心悅目。新武路峽的山洞極具特色，是一片片的板岩，山洞內凹凸形狀像個斑駁的大牆壁，可以了解台灣的地形變動。,新武路峽由初來至嘉寶，是沈積頁板岩受壓力形成岩板後，夾入結晶石灰岩，經萬年蘊育而成的大理石岩盤，新武路溪與大崙溪交會流經其間，流切割沖刷形成景色壯闊的峽谷景觀，兩岸峭壁高聳入雲，山勢挺拔蒼勁，構成令人心曠神怡的山水美景，堪稱南橫公路東段美景的精華區。,886-8-9931370,臺東縣957海端鄉初來至嘉寶之間,957,搭乘公車：搭乘東台灣客運8161、8163、8165、8166、8167次公車至關山站下車，轉乘東台灣客運8178次公車(往利稻)，於新武呂站下車步行前往，即可到達（小叮嚀：搭往利稻方向的車，一天僅上午下午各一班）。,24小時全年無休,{},"{'PositionLon': 121.12764739990234, 'PositionLat': 23.1370906829834, 'GeoHash': 'wsn5s7frq'}",自然風景類,{},臺東縣,2023-07-13T01:40:49+08:00,2023-07-13T02:10:57+08:00
C1_376540000A_000231,六口溫泉,「六口溫泉」位於臺東縣海端鄉，南橫公路179K處。行經此處的用路人，不難發現許多在此閒坐泡腳的遊客，以及帶著簡單用具，前來蒸煮溫泉蛋的在地居民。「六口溫泉」其實是早年開鑿南橫公路時，築路工人發現有溫泉水順著岩壁湧出，於是挖洞引出溫泉水，工作之餘作為休息舒壓之用。2008年，花東縱谷國家風景區管理處重新整理興建後，成為乾淨、舒適的六口溫泉池。 六口溫泉此處的泉脈與碧山溫泉同源，泉質上屬於可飲也可浴的「碳酸氫鈉泉」，清澈無味。由於此處的溫泉從新武呂溪旁的鐘乳石岩壁和溪床流出，因此出水口溫度高達攝氏70-80度，慢慢流至第四、五、六格之後的水溫才適合泡腳。縱管處也貼心的在每口溫泉池旁設置不同的水池溫度提醒牌示，避免遊客不慎燙傷。南橫公路沿線有不少知名的溫泉景點，由於六口溫泉池可免費泡腳，又位於美麗的山林溪谷邊，非常適合在旅程途中泡腳休息、小憩一會兒，一邊欣賞因溫泉水湧出、結晶形成的美麗鐘乳石岩壁，一邊聽著潺潺的溪水，再享用乾淨泉質烹煮出的香嫩溫泉蛋，也是一趟精實愜意的南橫溫泉小旅行了！,六口溫泉位於南橫公路179公里處，屬於碧山溫泉，早在南橫公路闢建時，就由挖路工人發現溫泉源頭，並築成六座簡易的泡湯池，工作之餘泡湯，紓解疲勞。經過縱管處97年底的改善後，路經南橫的遊客可以更輕鬆舒適的體驗峽谷溫泉，泡泡腳、煮個溫泉蛋，還可觀賞一旁金色的鐘乳石景觀。,886-8-9551637,臺東縣957海端鄉南橫公路184.5K,957,搭乘火車：搭乘臺鐵至關山車站，轉搭乘東台灣客運8178次公車(往利稻)於天龍橋站下車，往台20號道西行方向行進約1.5公里(約20分)，即可到達。搭乘公車：搭乘東台灣客運8161、8163、8165、8166、8167、8175次公車於關山站下車，轉搭乘東台灣客運8178次公車(往利稻)於天龍橋站下車，往台20號道西行方向行進約1.5公里(約20分)，即可到達。,全天候開放,{},"{'PositionLon': 121.02992248535156, 'PositionLat': 23.175199508666992, 'GeoHash': 'wsn5f4gm3'}",溫泉類,{},請注意溫泉槽上溫度標示，以防高溫燙傷。,臺東縣,2023-07-13T01:40:49+08:00,2023-07-13T02:10:57+08:00
C1_376540000A_000232,布農部落文化園區,西元1984年，白光勝牧師抱著麥子落土的精神，回到家鄉臺東縣延平鄉服務，於1994年開始思考原住民文化傳承與經濟生機兼顧的模式，隔年先後在伊甸社會福利基金會、勵馨基金會與7-ELEVEN的協助下，順利創立了第一個由原住民成立的「布農文教基金會」，也募得一千兩百萬元，開始了布農部落文化園區的初建工程。位於臺東縣桃源村的布農部落文化園區，以經營布農部落的形式，讓遊客們可以體驗原住民生活風貌、文化傳承、與休閒產業，藉此重建原住民文化，找回原住民的自信心，相對地提供人們體認原住民文化的機會，因此整個園區是集結了原住民傳統藝術與文化的綜合休閒農場，極富觀光特色。園區裡目前規劃的區域有每日兩場(AM10:30、PM2:00)的「布農部落劇場」表演（若客數不到30人，不演出，建議來電詢問當天是否有表演）；表演劇場的後面則是「特產中心」，提供在地居民的自製農產品如小米酒、檜木精油、竹炭、精油手工皂、果汁果醬、手炒花生等，以及充滿生命力的原民創作藝品。另外餐飲提供有部落餐廳和咖啡屋，相當具有原民的藝術風情；原木雕成的桌椅，每一組設計都讓人驚喜，屋頂則是用布農織布的線條色彩混搭。這裡的環境在溪谷高處，視野極寬闊，在此用餐更有悠閒自在的氣氛。除了美味的原民風味佳餚，加上熱鬧好聽的布農族音樂表演，和可選購好吃有特色的伴手禮之外，園區也提供了樸實富原住民特色的「部落民宿」，若安排來入住這裡，能夠更深刻體驗布農族當地的生活環境，亦方便到園區的農場、牧場和加工廠參觀，豐富精采的園區活動，既能夠讓人們可以多了解當地原住民文化，又可以讓在地居民得到自給自足的工作機會，互動之中也不經意地將布農族傳統的文化繼續傳承下去。,布農部落文化園區擁有豐美的農牧產業資源，園區內提供給遊客的在地美食皆是當令時節的時鮮蔬果與肉品；廣大的園區空間被規劃成表演場域、體驗學習空間以及藝品工作坊，提供了遊客前來體驗布農傳統文化和生活，也提供小木屋及咖啡屋的餐宿服務。遊客不妨可將鄰近的蝴蝶谷、紅葉溫泉規劃進來，來一趟有多元享受的生態文化之旅。,886-8-9561211,臺東縣953延平鄉桃源村11鄰191號,953,搭乘公車：搭乘東台灣客運8167、8168次公車於延平鄉公所站下車，往部落相反方向行進約200公尺左轉，再直行約400公尺可看見布農部落停車場及園區標示。,08:00 - 17:00,{},"{'PositionLon': 121.09087371826172, 'PositionLat': 22.905649185180664, 'GeoHash': 'wsn473zej'}",遊憩類,布農部落園區外有停車場。,{},入園一人250元【7歲以下兒童免門票】可抵園內消費100元,園區表演時間為早上10:30及下午14:00。入園人數30位以上才有演出。若不確定是否有演出，可入園前先撥打電話詢問。,臺東縣,2023-07-13T01:40:49+08:00,2023-07-13T02:10:57+08:00
C1_376540000A_000233,紅葉少棒紀念館,紅葉村，因秋天楓紅處處而得名，是典型的布農族部落，依然保持純樸原始的風貌，在早期是以種植玉米為主的小部落；紅葉國小，是帶動臺灣棒球發展風氣、因此名揚海外的紅葉少棒隊發跡地。當年紅葉國小的校長林珠鵬因為學生出席率不佳，發覺體力旺盛的原住民小朋友喜愛戶外活動與打獵，並且對棒球相當熱衷，林珠鵬便興起成立正式棒球隊的想法，就此開啟了紅葉的少棒傳奇。當年種種的光榮事蹟與記憶都收藏在紅葉國小校園內的紅葉少棒紀念館，館內陳列紅葉少棒隊昔日使用的球具、少棒英雄史、珍貴照片、文物等，重現昔日棒球英雄的矯健身影和光榮的時光，是追尋臺灣棒球發展歷史的必遊之地。館內二樓設有布農文物館和視聽室，將布農族文化與紅葉少棒隊聯結在一起，有助於更深入體認原住民在臺灣發展過程中的角色與地位。因為紅葉少棒隊，棒球在臺東是相當具有代表性的運動之一，可不時地在路邊球場遇見民間棒球隊進行友誼賽，各級學校培育的棒球選手，也經常代表國家在國際比賽中創下佳績，甚至也有職業棒球隊以臺東為訓練地點，棒球風氣歷久不衰。,在偏遠的臺東縣延平鄉，在這裡生活的，是純樸原始的布農族部落族人，原住民小朋友對於運動的天賦、以及當年紅葉國小校長以及邱教練的啟蒙，讓小小的布農族村落名揚國際，位在紅葉國小內的紅葉少棒紀念館，重現了昔日棒球英雄的矯健身影和光榮的時光。是走訪山地部落風光和紅葉少隊發源地的必遊之地。,886-8-9561015,臺東縣953延平鄉紅葉村紅谷路1號,953,紅葉部落周圍無公車抵達，建議租賃汽機車沿台9線於357公里處處轉鹿鳴產業道路續行約6公里至紅葉國小。,08:00 - 17:00(周二、周三休館),{},"{'PositionLon': 121.063720703125, 'PositionLat': 22.89352035522461, 'GeoHash': 'wsn44zeum'}",{},臺東縣,2023-07-13T01:40:49+08:00,2023-07-13T02:10:57+08:00
C1_376540000A_000235,卑南上圳,"卑南上圳進水口設於卑南溪水系鹿野溪支流上里地區，建有攔河堰一處（混凝土壩）設有六孔攔污柵進水孔，並設有一條長4,005公尺的導水隧道，沈砂池一座，排砂道二處以便排除沈砂池之淤砂。  進水口四周高聳山巒重重，與毗鄰之上方道路之紅色鋼拱橋，相互輝映，襯托出山澤「力」與「美」的結合；以及兩岸峭壁、清脆山巒，宛如世外桃源，直入空谷幽蘭之境界，因此，卑南上圳便漸漸有了「龍門峽谷」及「紅葉翠谷」之美名。臺東農田水利會在週邊設立步道及涼亭等設施，讓遊客在此可感受極悠閒的氛圍，加上與知名的紅葉溫泉、紅葉少棒紀念館、布農部落等著名景點相鄰，已成為本縣重要觀光景點，觀光客絡繹不絕。 到卑南上圳，可由臺東農田水利會所立「紅葉翠谷」刻石旁進管理站，站後涼亭是最佳賞景點。",卑南圳取水口，位於鹿野溪南岸的紅葉村上里部落，稱做「卑南上圳」，意在和岩灣的「卑南大圳」取水口區隔。臺東農田水利會特地為卑南上圳進行綠美化工程，讓遊客可在此感受卑南上圳放水時，奔騰而出直洩峽谷水瀑的壯闊非凡氣勢，加上鄰近的紅葉溫泉等著名景點，使得卑南上圳成為延平鄉重要的觀光景點。,886-8-9326100,臺東縣953延平鄉 鹿野溪上游,953,卑南上圳周圍無公車停靠，建議自行開車或租賃汽機車沿台9線於357公里處轉鹿鳴產業道路續行約2.5公里抵達卑南上圳，觀景亭入口有「紅葉翠谷」標記之石頭。,全天候開放,{},"{'PositionLon': 121.05716705322266, 'PositionLat': 22.87734031677246, 'GeoHash': 'wsn44sxnh'}",自然風景類,{},臺東縣,2023-07-13T01:40:49+08:00,2023-07-13T02:10:57+08:00
