ScenicSpotID,ScenicSpotName,DescriptionDetail,Description,Phone,Address,ZipCode,TravelInfo,OpenTime,Picture,Position,ParkingPosition,TicketInfo,Remarks,City,SrcUpdateTime,UpdateTime
C1_376540000A_000473,千年夫妻樹,夫妻樹的樹種為榕樹，彼此一前一後的聳立山坡上。「老婆樹」位置較低，枝幹較軟，葉片肥胖為橢圓狀，會結果子；「老公樹」位置較高，枝幹較硬，葉子較細且長、不結子。老婆樹的樹齡為約五百年，樹高達25公尺，胸徑約6公尺，樹冠幅240坪，老公樹樹齡根據當地人表示則約1500年。原本相擁的夫妻樹，在一次颱風天時，老公樹的手臂被雷擊劈了下來，硬是將他們活生生的拆散。本來老公樹就是伸出這根枝幹擁抱老婆樹的，如今手臂一斷，就看不到兩樹深情相擁的畫面了。經歷數百年的夫妻樹，其珍貴的價值被列為臺東縣列管珍貴樹木，甚至在臺東縣社教館舉辦的花東地區美景選拔中，獲選入前十大美景。吃完斑鳩冰淇淋，在夫妻樹的環樹步道散散步，若有時間，還可附近的東鳩窯體驗捏陶的樂趣。,千年夫妻樹位在臺東縣卑南鄉的美農社區內，是二棵樹齡加總已千年的老白榕樹。其特別的相擁模樣，被一位記者加以報導，使得夫妻樹漸漸成為地方上的著名景點。來到美農社區，不妨可買杯號稱國宴冰淇淋的斑鳩冰淇淋，坐在夫妻樹下愜意品嚐。,886-8-9381368,臺東縣954卑南鄉美農社區,954,搭乘公車：搭乘東台灣客運8161、8163、8165、8166、8167、8168、8170、8171次公車於東成站下車，進入站旁東47鄉道行進約1.5公里至東成國小左轉，經過斑鳩冰品約1公里後右轉小路續行約600公尺即到達。自公車站至景點約3公里，建議租賃交通工具前往。,全天候開放,{},"{'PositionLon': 121.07553100585938, 'PositionLat': 22.839670181274414, 'GeoHash': 'wsn1gjud8'}",{},臺東縣,2023-07-13T01:40:49+08:00,2023-07-13T02:10:57+08:00
C1_376540000A_000474,樂山休閒農場,充滿綠意的門口有著大大的「樂山」二字，彷彿感受到了農場主人熱情的招呼，農場內有種植了許多蔬菜及水果，以及圈養了許多種類的動物，包括麝香豬、山豬、羊、雞、狗等等，充分令人體驗到濃厚的田園樂趣。  若遊客入住在農場內，便可輕鬆自在的觀看臺東的日出以及欣賞夜景；晚上在此吃飯喝茶暢聊天南地北之餘，更有大家很愛的卡拉ok助興，使得農場的白天和夜晚都相當的熱鬧不已。 由於農場主人的用心，將農場規劃的盡善盡美，其可愛純樸的田園造景，使得遊客們都能在農場內玩的非常盡興，是一處集合眾多功能的開心農場。,樂山休閒農場座落在知本溫泉區附近的樂山上，從溫泉飯店林立的龍泉路一路往上，路邊不時地會出現醒目的紅色指示，引領著遊客前往，經過一段時間的峰迴路轉後，便會到達擁有開闊視野的樂山休閒農場，農場的面積廣大，是個適合全家大小一同前來渡假、賞夜景和觀日出的好所在。,886-8-9515919,臺東縣954卑南鄉溫泉村樂山65號,954,搭乘火車：搭乘臺鐵至知本車站，可轉搭鼎東客運山線8129次公車(往知本森林遊樂區)於白玉瀑布站下車，轉入龍泉路43巷，依沿途「樂山休閒農場」指標前進約3公里可到達。搭乘公車：搭乘鼎東客運山線8129次公車於白玉瀑布站下車，轉入龍泉路43巷，依沿途「樂山休閒農場」指標前進約3公里可到達。因景點位置偏遠，建議租賃交通工具前往。,全天候開放,{},"{'PositionLon': 121.00395202636719, 'PositionLat': 22.685949325561523, 'GeoHash': 'wsn119b7h'}",遊憩類,{},臺東縣,2023-07-13T01:40:49+08:00,2023-07-13T02:10:57+08:00
C1_376540000A_000475,鹿野龍田自行車道,龍田自行車道全長約7.2公里，附近有許多景點可以欣賞，如知名的小葉欖仁綠色隧道，綿延一公里的綠色隧道舒適涼爽，蔭涼的樹蔭配上蟲鳴鳥叫，讓人心曠神怡，若是跟隨著當地腳踏車店的導遊踏尋這裡，導遊會讓遊客在這裡的車道上躺下，感受鹿野最舒服的環境，跟其他的自行車道的體驗非常不一樣！由於早期龍田村是個移民村，所以可以看到一些日式傳統建築，純正的日本味是每個遊客拍不停的著名景點，另外還有證嚴法師的駐息地－崑慈寺，行經茶葉改良場時，也可看到難得的採茶景色，都是很有特色的在地景點。龍田另有「蝴蝶的故鄉」之稱，低頭可看到地上有蝴蝶的標誌，抬頭看路標也有蝴蝶的模樣，如果季節來對的話，或許還可以看到蝴蝶翩翩飛舞。路途上所到之處都美得像幅畫，令人流連忘返。若想再騎遠一點，可以騎上具有挑戰性的鹿野高台，或是也可以騎去鹿鳴吊橋那一帶，那裡可是泡溫泉的好地方。來到龍田真的可以待久一些，因為四周的景色真的會讓您沉醉其中。,在臺東縣鹿野鄉的龍田自行車道騎腳踏車是近年來相當熱門的旅遊行程，是走遍鹿野的最佳休閒路線。全長約7.2公里，車道樹蔭眾多，騎起來異常舒適涼爽，車道地勢也較為平坦，四周為農田、茶田等農地景觀。是條具有豐富自然景觀和歷史文化的自行車路線。,886-8-9552136,臺東縣955鹿野鄉龍田村,955,搭乘火車：搭乘臺鐵至鹿野車站，沿台9線南下方向行進約300公尺轉入光榮路，續行約1.5公里可到達龍田村；也可轉搭乘公車前往。 搭乘公車：1.搭乘東台灣客運8161、8163、8165、8166、8167、8168、8170次公車於光榮站下車。2.搭乘台灣好行縱谷鹿野線於崑慈堂站下車。,全天候開放,{},"{'PositionLon': 121.11573028564453, 'PositionLat': 22.904329299926758, 'GeoHash': 'wsn4k19g3'}",遊憩類,{},臺東縣,2023-07-13T01:40:49+08:00,2023-07-13T02:10:57+08:00
C1_376540000A_000476,崑慈堂,崑慈堂的現址原為日據時期鹿野移民村內的神社所在地，在臺灣光復後，日本人將神社內奉祀的神明請回日本，當地的居民就在神社原址奉祀土地公。民國四十二年(西元1953年)，當地信眾請來媽祖奉祀，至民國四十七年又迎瑤池金母令旗入祀。崑慈堂屬公廟性質，除主祀瑤池金母外，同祀有釋迦佛祖、觀音菩薩、天上聖母、臨水夫人、中壇元帥及居民從彰化後寮原鄉移祀來的玄天上帝。崑慈堂最具特色的，莫過於堂前高齡的老茄冬與苦楝樹；樹齡超過80年，樹高約20公尺，樹圍4.2公尺，樹冠幅約150平方公尺，樹旁佇立著原為日本神社的崑慈堂，是龍田村村民平時相聚聊天的聚會所在，且在民國四十九年，崑慈堂草創之初，當時尚未剃度出家的證嚴法師曾隨師父在此掛單修行三個月，常在此樹下與村民談論佛法，因此慈濟人將此樹命名為「慈濟樹」，紀念此地為上人首修之地。龍田村景色迷人，充滿鄉野情趣，騎上單車，在筆直的聯外道路光榮路綠色隧道展開生態之旅，體驗生命與自然相結合的動人時光。,主奉瑤池金母的崑慈堂，座落在臺東縣鹿野鄉龍田村光榮路308號，這裡原來是日據時期鹿野移民村內的神社的所在地，崑慈堂發展至今，已成為龍田村的信仰中心。又因為與證嚴法師有所因緣，寺廟的苦楝樹因此被稱為「慈濟樹」，成為花東地區遠近馳名的廟宇。,886-8-9551451,臺東縣955鹿野鄉龍田村光榮路308號,955,搭乘火車： 搭乘臺鐵於鹿野車站下車，距離崑慈堂還有約2.5公里，可選擇搭乘東台灣客運8161、8163、8165、8166、8167、8168、8170次公車至光榮站下車，或台灣好行縱谷鹿野線於崑慈堂站下車。 搭乘公車： 1.搭乘東台灣客運8161、8163、8165、8166、8167、8168、8170次公車，於光榮站下車即到達。2.搭乘台灣好行縱谷鹿野線於崑慈堂站下車即到...,08:00 - 18:00,{},"{'PositionLon': 121.12042236328125, 'PositionLat': 22.90452003479004, 'GeoHash': 'wsn4k1thq'}",門口空地可以停放小客車,{},宗教場所請勿喧嘩吵鬧,臺東縣,2023-07-13T01:40:49+08:00,2023-07-13T02:10:57+08:00
C1_376540000A_000479,綠洲山莊,綠島人權文化園區總面積約32公頃，占地極廣，涵蓋將軍岩、人權紀念公園、綠洲山莊、莊敬營區（新生訓導處）、綠島技能訓練所、燕子洞等，極具人權發展的歷史意義。  綠洲山莊正式名稱為「綠島感訓監獄」，源自1970年2月8日發生的「泰源事件」，當時國民政府在綠島「新生訓導處」西側建造一座高牆式監獄，也就是現在的綠洲山莊。之後陸續將泰源監獄與各地軍事監獄中的思想犯遷移至此，統一管理，進行感化教育與思想改造，成為人權迫害與政治事件受難者的集中營。1987年國民政府解除戒嚴，綠洲山莊從此廢置。 四周高牆聳立的綠洲山莊是典型的封閉型監獄，牆壁繪製了各種愛國標語，如「堅定反共」、「苦海無邊」、「毋忘在莒」、「回頭是岸」、「滅共復國」等等。整座監獄主體建築為牢房，有一、二樓，內部結構為六角形，但綠島人習慣稱八卦樓，因為在綠島的過山古道鳥瞰綠洲山莊，看起來就像是一個八卦圖案。,綠洲山莊為白色恐怖時期的產物，是當時專門用來囚禁政治犯與思想犯的場所。為了紀念在戒嚴期間，受到不當壓迫以及為民主思想奮鬥的人士，就在這處具有指標性意義的地點，保留了昔日高聳的圍牆、鐵絲網、操場、禮堂和八卦樓等建築，規劃建立了綠島人權文化園區。,886-8-9671095,臺東縣951綠島鄉公館村將軍岩20號,951,海路：從臺東富岡搭乘客船到綠島，單程船程約50分鐘。空路：從臺東豐年機場搭乘小型飛機，單程航程約15分鐘。,每日：09:00-17:00(中午不休息)；每年10月至隔年4月，每周一休園,{},"{'PositionLon': 121.49656677246094, 'PositionLat': 22.674800872802734, 'GeoHash': 'wsn2uxz47'}",{},●定時導覽每日10:00、15:00各有一場定時導覽，欲參加者請逕至綠洲山莊遊客服務中心集合。5-9月增加兩場次9:30、13:30。●團體導覽服務1. 僅提供電話報名(請提前一周...,臺東縣,2023-07-13T01:40:49+08:00,2023-07-13T02:10:57+08:00
C1_376540000A_000481,富源觀景台,富源觀景台位於高地上，是一個觀看風景的地方，眺望景觀廣達360度，視野開闊。觀景台由木棧平台和涼亭構成，身處富源觀景台，可以眺賞都蘭山，都蘭灣圓弧的灣口亦清晰可見，若天氣晴朗，甚至能遠望綠島。觀景台的另一邊，可以看見卑南溪、小黃山、利吉惡地等獨特地理景觀，錯落有致的民房散落平原之間，站在這置高點，望盡臺東平原與東海岸景致，感受人的微渺與天地的廣闊。倘若選在秋冬造訪，有機會能見到大冠鷲、鳳頭蒼鷹等猛鷹遨翔天際。,沿著臺東縱谷的197號公路走，大約在56公里處，可以看見富源觀景台，這裡是一處新興的景點，很適合停車駐足，做為遊途中的休息站，觀賞360度的臺東美景，也很適合做為觀察臺東地理環境的據點。,886-8-9551637,臺東縣954卑南鄉富源197縣道56公里處,954,搭乘火車：搭乘臺鐵至臺東車站，轉搭乘興東客運8117次公車於利吉前站下車，沿197縣道南下方向行進約3.8公里依指標右轉支線後續行約150公尺即到達。搭乘公車：轉搭乘興東客運8117次公車於利吉前站下車，沿197縣道南下方向行進約3.8公里依指標右轉支線後續行約150公尺即到達。,周一至周日08:00~17:00 （非開放時間禁止進入⛔️謝謝配合）,{},"{'PositionLon': 121.15213775634766, 'PositionLat': 22.828590393066406, 'GeoHash': 'wsn1ugu61'}",自然風景類,富源觀景台旁有停車場。,{},免費參觀,本園區座落於私人土地，無償供公眾使用，並由地主柯先生維護管理，為維護環境清潔及居家安寧，請勿隨意棄置垃圾，非開放時間請勿進入，謝謝配含。,臺東縣,2023-07-13T01:40:49+08:00,2023-07-13T02:10:57+08:00
C1_376540000A_000483,臺東表演藝術館,鮮紅醒目的外牆，強烈地吸引過往行人的目光，這是臺東表演藝術館，讓人無法忽視。 臺東表演藝術館位在鐵道藝術村附近，館內具備完善的燈光及音響設備，是東臺灣難得一見的小型專業展演場所。這裡原本是臺東劇團的表演場地，臺東劇團致力推展戲劇於生活中、創作屬於臺東人的戲劇，現在藝術館也提供其它外來表演團體的租借，讓更多戲劇與表演愛好者擁有一個展現創作和自我的舞臺。臺東表演藝術館內部有兩大主體，首先是「臺東劇團藝廊」，雖然僅有15坪大的空間，卻是個「小而美」的展場；藝廊的另一側，則是黑盒子劇場，它是表演藝術館的主題，舞台和觀眾席幾乎無距離，觀眾可近距離觀賞舞者的表演，強烈感受藝術的氛圍。  藝術館外是鐵道藝術村的延伸，也是散步、休閒的步道。棧道兩旁隨季節氣候變換顏色的變葉木與行道樹，形成一股自在的悠閒氛圍。藝術館入口處是一休息區，提供散步民眾歇腳，有時也充做室外小型表演場，讓藝術更加親近民眾。 來到臺東表演藝術館，你會驚覺，大家所謂的「後山」，竟蘊藏如此豐沛的創作能量，找個時間，來這裡看場表演，感受東臺灣的藝術力量。,位在鐵道藝術村附近的臺東表演藝術館，亮眼的建築外觀，給人強烈的第一眼印象，內部設備完善，是臺東地區優質的小型戲劇演出場地，也是展現屬於臺東在地的藝術創作空間。,886-8-9346709,臺東縣950臺東市開封街671號,950,搭乘公車：1.搭乘鼎東客運山線8130、8131、8132、8135、8137、8138、8150、8151、8153、8161、8163、8165、8166、8167、8168、8170、8171次公車。2.搭乘鼎東客運海線8101、8103、8109、8112、8113、8116、8117、8118、8122、8128次公車。於舊縣議會站下車，直行左轉開封街後，前行約500...,{},"{'PositionLon': 121.13877868652344, 'PositionLat': 22.759660720825195, 'GeoHash': 'wsn1kx68d'}",{},休館時間：週日、一及例假日,臺東縣,2023-07-13T01:40:49+08:00,2023-07-13T02:10:57+08:00
C1_376540000A_000484,寶町藝文中心,「寶町藝文中心」原為臺東市中山路與寶桑路口處的舊市長官舍建築群，是昭和11年(1936)所興建的職務宿舍，共有6間日式木造建築。這幾棟日式宿舍全為地面一層的木造結構，包括宿舍、庭園等，形制完整，建築完美，具有歷史價值。這些日式官舍原本年久失修，影響市容觀瞻，整建完成後，將室內空間規劃成小型藝廊、藝文團體交誼室、藝文資料室等，庭院增設小型展演場，不僅可舉辦藝文展演活動，夜間亦可設置蚊子電影院。寶町藝文中心的出現，不僅改善了市容，也提供一處臺東市民可以休憩、遊戲的空間，並且成為市政資料展示中心及地方藝術家或藝文社團交流、聯誼的場所。寶町濃濃的懷舊感與藝文氣息，值得來此漫步，感受老建築新生的活力。,老建築總是帶給人溫潤的歷史感，寶町藝文中心是日式建築活化的絕佳例子，前身是舊市長官舍建築群的寶町藝文中心，距今已有77年的歷史。整建完成後，風華再現，為臺東市又增添一處值得細細品味的藝文空間。,886-8-9340407,臺東縣950臺東市中山路182號,950,搭乘火車：搭乘臺鐵至臺東車站，轉搭乘客運至旅服中心轉運站後搭乘鼎東客運海線或市區公車(普悠瑪客運)前往。搭乘公車：1.搭乘鼎東客運海線8102、8119、8120公車於吳外科站下車後沿中山路往森林公園方向行進約150公尺即到達。2.搭乘市區公車(普悠瑪客運)觀光循環線於臺東醫院站下車，沿中正路往海岸方向行進約150公尺左轉中山路，續行約100公尺可到達，位於道路左側。,09:00 - 12:00、14:00 - 17:00(周一休館),{},"{'PositionLon': 121.15321350097656, 'PositionLat': 22.758159637451172, 'GeoHash': 'wsn1kyvpf'}",{},臺東縣,2023-07-13T01:40:49+08:00,2023-07-13T02:10:57+08:00
C1_376540000A_000485,麻荖漏步道,麻老漏步道的名字起源於成功鎮的舊名為麻荖漏，意思為「草木枯萎之狀」、「烤乾之地」、「東西在火上展開烘乾」等含意的阿美族語。據文獻記載，阿美族人最早於清初時期就已移居本地，並形成聚落，但在西元1850年左右，此區遭遇大海嘯侵襲，致使土地上草木不生，極似被火烤乾之狀，且不宜耕種，故得此名。  步道全長1160公尺，步道盡頭是著名的新港瀑布(彩虹瀑布)。本步道原為當地舊有集水取水路徑，溯溪而上可達彩虹瀑布下方。由於本步道為成功鎮重要取水口，因此該步道之修築有別於一般的健行步道，主要以不污染水源為原則，採用最自然的方式與材料，小徑材料不作防腐處理，並順應地形以生態工法整修成讓民眾容易親近的溯溪健行步道。步道沿線起伏甚大，除穿越山林之外，部分路段需翻越巨石、穿越山洞及橫渡溪流，只要輕便溯溪裝備就可享受冰涼清澈的水流沖擊感又無深潭急流的顧慮，遊客可同時體驗溯溪與森林浴的樂趣，是一條老少咸宜的戲水溯溪健行步道。 步道入口處，有棵胸徑達60公分以上的白榕昂然立於懸崖之上，支柱根生長如拱門，造型相當有趣而獨特。沿著溪谷路段前行，耳邊不時可聽見「啾~」的叫聲，一般人都以為是某種鳥兒的叫聲，但其實那是斯文豪氏赤蛙獨特的鳴叫聲，很多賞鳥初學者常被這種蛙類的叫聲混淆，因而也被稱之為「騙人鳥」。  麻老漏步道有別於一般步道，數段沿新港北溪溯溪谷而上的路段不用繁重的溯溪裝備，是一條稍微具有挑戰性的溯溪健行步道。,麻荖漏步道位於臺東縣成功鎮，終點是名列臺灣十大名瀑之一的新港瀑布，是條兼具多重功能的健行步道。其路徑行經山林中以及山洞、溪流，步道沿線起伏甚大，但只要輕便溯溪裝備，便可同時體驗溯溪與森林浴以及生態觀察的樂趣。,886-8-9851027,臺東縣961成功鎮三民產業道路,961,搭乘公車：搭乘鼎東客運海線8101、8102、8103、8107、8119、8120、8125次公車於三民國小站下車，沿三民路直行左轉富榮路，遇叉路右轉三民產業道路續行約4公里後沿右側道路直行，於豎有麻老漏步道指示牌之叉路左轉上坡至麻荖漏步道入口，整段路程約6公里。建議租賃交通工具前往。,全天候開放,{},"{'PositionLon': 121.34748077392578, 'PositionLat': 23.129840850830078, 'GeoHash': 'wsn796dt1'}",遊憩類,麻荖漏步道前有小型車停車場可供停放。,{},1、全程為溪谷路段，由於溪石路滑，健行時應注意。2、雨天過後易造成土石坍方及溪水暴漲，且於雨中行走易造成打滑危險，出發前請留意天氣狀況。3.往步道路上皆為產業道路，人跡罕至，行前請...,臺東縣,2023-07-13T01:40:49+08:00,2023-07-13T02:10:57+08:00
C1_376540000A_000487,池上飯包博物館,光復初期花蓮到臺東的火車需要8小時的時間，因此當時最早的池上飯包就是為了讓搭火車的旅客能夠在漫長的旅程中享用而製作的，剛開始的飯包是用竹葉包裝，裡面是4個包著肉乾與酸梅的三角飯團，後來逐漸演變成木盒包裝，以池上米煮成的飯，搭配卜肉、燒肉以及古法製作的醬菜、大坡池捕獲的蝦等食材。隨著時代改變，池上飯包嚴格把關原物料，創造出更豐富多元的菜色，用現代化的經營，延續老字號的新生命。飯包博物館內區分為「歷史文化區」、「農田農具區」、「稻米文化區」、「池上飯包區」、以及「古早飯包區」等多個展示區，以文字及圖片介紹池上飯包歷年來的發展沿革，同時還典藏著早期做飯包時使用的傳統爐灶等器物。因此池上飯包博物館不但可以提供民眾參觀，同時還兼具著文化保存與教育等多重功能。來到池上飯包博物館，除了吃飯包是一大重點外，其它看的、玩的也都相當多元，是個可以晃一小段時間的旅遊景點。另外，除了一般寬敞舒適的用餐區外，遊客更可坐在門前於臺鐵退役的火車車廂內用餐，充分感受在火車上的懷舊風情，比起在真的火車上吃著池上飯包，更有種愜意的旅行氛圍。,位於台9線上的悟饕池上飯包原創老店，是集山企業於民國89年合併老字號的池上飯包老店後開設的，除了一樓寬敞舒適的用餐區，以及池上特產販賣區及古早味零食和童玩外，二樓更規劃為介紹池上飯包歷史沿革的飯包博物館，館內豐富的內容、寬敞的空間，已然成為公路上全方位的休息站了。,886-8-9862326,臺東縣958池上鄉忠孝路259號,958,搭乘火車：搭乘臺鐵於池上車站下車，出站後直行中正路約300公尺，位於中正路與忠孝路口。搭乘公車：1.搭乘東台灣客運8161、8163、8165、8166、8173次公車於池上站下車，往台9線(中山路)北上方向行進約200公尺右轉中正路，續行約200公尺至忠孝路口可到達。2.搭乘花蓮客運1138次公車於池上站下車，直行中正路約200公尺至忠孝路口可到達。,10:30 - 19:00,{},"{'PositionLon': 121.22090148925781, 'PositionLat': 23.12425994873047, 'GeoHash': 'wsn5w3wke'}",遊憩類,池上飯包博物館旁有停車場可供停車。,{},臺東縣,2023-07-13T01:40:49+08:00,2023-07-13T02:10:57+08:00
